{
  "schema": "simplicio.render-manifest/v1",
  "contract": "clients/ligne/video-03-pov-bruna-7/contract.yaml",
  "contract_sha256": "3895e5c4206e50963a010650588d64c45d7767490cddb0c06bc36f8e5cf5e165",
  "timing_lock_sha256": null,
  "template": "pov-showcase",
  "backend": "local",
  "quality": "delivery",
  "gpu_encode": false,
  "inputs_sha256": "56bacc8040f187e97c67187729b707cf8fef51bd0e0925700ef547c188cb6c09",
  "inputs": {
    "assets/audio/build/mix.wav": "36747af6c8a97c93ae5c302705f34422eae7b1395cafb326e41b1877fd929c56",
    "assets/client/prancha-1.jpg": "6a8f244fb5853a6884f97326711fd13b802ccecfb1aeca2c1c7e3fa3df2cfb81",
    "assets/client/prancha-2.jpg": "a5399366dd67fe051b937ccf38199f973a7b3715597426a493ff81275e831b1b",
    "assets/client/prancha-3.jpg": "06e14f4e0d374977b12ad4f08f5b73a7249681258823ec2b6401110bb24bbf21",
    "assets/client/prancha-4.jpg": "1db1f68f99e953d3369b90f6b9b455f3ba8786ddd0bdd0e55d29be0e3da80e2b",
    "assets/client/prancha-5.jpg": "5922cdbc266516d7fc0e254fb6a5fab075b7ad506d4b125adc5e284b1ac8d5a9",
    "assets/client/prancha-6.jpg": "ac0983e99d76e7bdce7fdfd697ba7065f49315da5a4ef1489236c056640db8f7",
    "assets/client/prancha-7.jpg": "392c4eb9c325ff098668fc477ffb3a4a6c616ce4909cbeca918d22cd1be47c17",
    "assets/client/rosto.png": "5dc977d5ecd82b8f7bf3fd1d5ed2d37ff0c2b26c7f0f261f24fb879e6beb009a",
    "assets/fonts/Inter.ttf": "29160a80ff49ddcab2c97711247e08b1fab27a484a329ce8b813d820dc559031",
    "assets/fonts/OFL-Inter.txt": "5b9321a4298cfeb6b34354164a1c3afc3db114569984c502b9b35d988fd58c57",
    "build/mix.raw.wav": "5003d0f403e44365ce652277c24b916fbdbdc565b0ccb772fcfab04c35426681",
    "build/variables.json": "44136fa355b3678a1146ad16f7e8649e94fb4fc21fe77e8310c060f61caaff8a",
    "compositions/board-pan.html": "3635a4077bfc6f5cc516060ef158efbccbeabfc2018d8b8e43effbd7e70c78c3",
    "compositions/portrait-board-close.html": "768f71931fa4e62647c16c82e24c133ff3cae24ea57b210e6c9f8e938380f356",
    "compositions/pov-face-hook.html": "40f4ff0538beb716bea099dafe22c579caeb378ca2df37b0d007c7c8dfda30d3",
    "hyperframes.json": "7760693dcdca6a31fffd9ed53b7fe9b4d7877089b1778edc5a5de0cb4bac517d",
    "index.html": "a91013578b668e5de5e4289ae37db2f63da099a86db4a152cb9fef3164cf7400",
    "meta.json": "f858c247dbc00522f0833a9735b25b86304a86c0028d48c3b81f7e1c84c68d81",
    "scripts/build.mjs": "024ee74254a9c26916dea00d9e9441927968ab3060e37a71740a1380b0a1caab",
    "scripts/master.sh": "ce717e9f1e6f2c7c28f39e795c93f0b16657206a69448eeb7cb37742d021f4ea",
    "spec.json": "0f08459c7d1cf24c2b79a8ebd28d381289a481f1d034cacd83add3340a46661b"
  },
  "tools": {
    "simplicio_video": "0.5.0",
    "hyperframes": "hyperframes@0.8.97",
    "node": "v26.8.2",
    "ffmpeg": "ffmpeg version 9.0.2 Copyright (c) 2000-2026 the FFmpeg developers",
    "python": "3.12.13"
  },
  "output": {
    "path": "out/ligne-pov-pov-bruna-7-v1-silencioso.mp4",
    "sha256": "62e3860ad48f7fdfb0069b7b1ca554fdcd703bb6dfe539dabc44947b62e38798",
    "duration_s": 26.1,
    "frames": 783,
    "video_frames_sha256": "4ec9dda2bd51099dab9430d785c3451ea93fdac2f18d5a74b4d19ce4744cf52f",
    "audio_pcm_sha256": "ece9e98252ccc0b413a9ee717238fcde9b4bcc0f955aad2d7ef14e02768b62a6"
  },
  "loudness": {
    "integrated_lufs": -14.1,
    "true_peak_dbfs": -1.5
  },
  "timings_s": {
    "compile_build": 4.93,
    "render": 85.51,
    "capture": 78.4,
    "encode": 78.4,
    "master": 4.91
  }
}
