{
  "schema": "simplicio.render-manifest/v1",
  "contract": "clients/ligne/video-01-pov-wesley/contract.yaml",
  "contract_sha256": "cfefd704f7f030a8e8b1a8714fe56d4c4c090fd21e1d579f495bbdf185dbbb57",
  "timing_lock_sha256": null,
  "template": "pov-showcase",
  "backend": "local",
  "quality": "delivery",
  "gpu_encode": false,
  "inputs_sha256": "8dd0a380d69745ef2eef0df00161531458f9932ce7772c30127f8f8e33d889e1",
  "inputs": {
    "assets/audio/build/mix.wav": "36747af6c8a97c93ae5c302705f34422eae7b1395cafb326e41b1877fd929c56",
    "assets/client/prancha-1.jpg": "e6143c2b760250ce9ebedeff2b500971a5e65d51b57bd749eda20e0bfc0387a5",
    "assets/client/prancha-2.jpg": "ced24f2dc253f482248f308499b0dbe2a538111acd8ce8b3e1abed5958e2c39f",
    "assets/client/prancha-3.jpg": "cec256fa08e06bc6414af0168b8798afc923d03dca9e01312cad60ec087bf954",
    "assets/client/prancha-4.jpg": "a13e3e00c047970d9b90e503eec23d89f5d9d1712c436f9debc56c1e647fde08",
    "assets/client/prancha-5.jpg": "86e932ead924e3c96c566ed99689d498527af9f48859c63ea81310ec678d8050",
    "assets/client/prancha-6.jpg": "4b68157d253ba2bd71316e4918d3673088771c28532a064f9643d289f4d6a1a5",
    "assets/client/prancha-7.jpg": "befc666796a8db3c15fc21d434dfb63e72b27163d02bdd3f70d58ee173018cc9",
    "assets/client/rosto-wesley-hd.png": "d83e4beb4d42708568d5b7e9740f9914fee9dd15c409c4d80493ba648241283a",
    "assets/client/rosto-wesley.png": "a3ca3e4c4c8953454a72c800673e94e990dda3cf429746dadd77ebcd70e3c9a4",
    "assets/fonts/Inter.ttf": "29160a80ff49ddcab2c97711247e08b1fab27a484a329ce8b813d820dc559031",
    "assets/fonts/OFL-Inter.txt": "5b9321a4298cfeb6b34354164a1c3afc3db114569984c502b9b35d988fd58c57",
    "build/mix.raw.wav": "5003d0f403e44365ce652277c24b916fbdbdc565b0ccb772fcfab04c35426681",
    "build/variables.json": "44136fa355b3678a1146ad16f7e8649e94fb4fc21fe77e8310c060f61caaff8a",
    "compositions/board-pan.html": "3635a4077bfc6f5cc516060ef158efbccbeabfc2018d8b8e43effbd7e70c78c3",
    "compositions/portrait-board-close.html": "768f71931fa4e62647c16c82e24c133ff3cae24ea57b210e6c9f8e938380f356",
    "compositions/pov-face-hook.html": "40f4ff0538beb716bea099dafe22c579caeb378ca2df37b0d007c7c8dfda30d3",
    "hyperframes.json": "7760693dcdca6a31fffd9ed53b7fe9b4d7877089b1778edc5a5de0cb4bac517d",
    "index.html": "9929b20d408647a4056ef2277d1823b7c2fa5f340e0949b0d971bd9a70c4180f",
    "meta.json": "9fbf9c25460feb9f2845818df05ce8f060d655ac7dd1ae7bd184c2c4b2de33ec",
    "scripts/build.mjs": "024ee74254a9c26916dea00d9e9441927968ab3060e37a71740a1380b0a1caab",
    "scripts/master.sh": "ce717e9f1e6f2c7c28f39e795c93f0b16657206a69448eeb7cb37742d021f4ea",
    "spec.json": "9ac5f609e1c9346a8f9ae19bac50a6cc4352131e9122dee188b887381ca4c2cd"
  },
  "tools": {
    "simplicio_video": "0.5.0",
    "hyperframes": "hyperframes@0.8.97",
    "node": "v26.8.2",
    "ffmpeg": "ffmpeg version 9.0.2 Copyright (c) 2000-2026 the FFmpeg developers",
    "python": "3.12.13"
  },
  "output": {
    "path": "out/ligne-pov-wesley-v4-silencioso.mp4",
    "sha256": "3d685bd956658671e4e9078c2853b58dc761b868ffe5ae9ad54882a889f9978d",
    "duration_s": 26.1,
    "frames": 783,
    "video_frames_sha256": "f109ce26004f9e55aae4925c4e7d739ce1bdf571089d4581276906b1d390be9e",
    "audio_pcm_sha256": "ece9e98252ccc0b413a9ee717238fcde9b4bcc0f955aad2d7ef14e02768b62a6"
  },
  "loudness": {
    "integrated_lufs": -14.1,
    "true_peak_dbfs": -1.5
  },
  "timings_s": {
    "compile_build": 4.15,
    "render": 61.18,
    "capture": 55.8,
    "encode": 55.8,
    "master": 3.61
  }
}
